Ticket id,Interaction id,Interaction date,Mailbox,Ticket Summary,Interaction content,Innso TYPOLOGY_TICKET ,Type 1,Type 2,Type 3,Type 4,Unnamed: 11
24310,68365,,support.eu@aspiegel.com,[HUAWEI Music] Problems and Suggestions,Mxxxxx@xxxx.com Sent from my Huawei phone,AppGallery / Other Requests,AppGallery ,Others,,,
24075,67730,,support.pt@aspiegel.com,[AppGallery]Problems and suggestions,Description Update cannot be installed Contact information Sxxxxx@xxxx.comDescription Update cannot be installed Contact information Sxxxxx@xxxx.com Description Update cannot be installed Contact information Sxxxxx@xxxx.comDescription Update cannot be installed Contact information Sxxxxx@xxxx.com,AppGallery / Suggestions &amp; Feedback,AppGallery ,Problem/Fault,AppGallery-Install/Upgrade,Can't update Apps,
24075,67762,,support.pt@aspiegel.com,Re: RE : [AppGallery]Problems and Suggestions Re: RE : [AppGallery]Problems and Suggestions,"Thank you After reinstalling the app everything works perfectly Regards *****(PER) wrote on Thu, Sep 8 *****(PHONE), 8:42 PM: Dear customer, thank you for contacting Aspiegel. We hope you are well. In order to offer you the best solution, we ask you to specify your request with the following information: 1. A description of the problem 2. A screenshot or video recording of the error 3. When the problem occurred 4. Your Huawei ID: App Gallery>HMS core>Open and then take a screenshot 5. Your phone model 6. SN number of your device 7. App Gallery version: Huawei App Gallery>Me>About 8. HMS Core version: Huawei App Gallery>HMS core>Open>Settings>About 9. Related app 10. Related app version 11. The App Gallery log If you have any further questions, please reply to this email thread and we will be happy to help you. Kind regards, *****(PER) Customer Support team A Aspiegel SE is an empresa constituída segundo as leis da *****(LOC), com sede em Dublin, *****(LOC). Aspiegel SE is the provenor of Huawei Mobile Services for Huawei and Honor proprietários de dispositivos in Europe, Canada, Australia, New Zealand and other countries. From : xxxxx@xxxx.com Sent : Thursday 08 September *****(PHONE) 20:07 To : xxxxx@xxxx.com Subject : [AppGallery]Problems and Suggestions Description Cannot install update Contact information Sxxxxx@xxxx.com *****(PHONE)",AppGallery / Suggestions &amp; Feedback,AppGallery ,Problem/Fault,AppGallery-Install/Upgrade,Can't update Apps,
23748,66706,,support.pt@aspiegel.com,[AppGallery]Problems and suggestions,Description . Contact information Axxxxx@xxxx.com,AppGallery / Other Requests,AppGallery ,Suggestion,AppGallery-Use,Others,
23740,66684,,support.eu@aspiegel.com,,I paid but the application did not work can I be refunded. Thank you,AppGallery / Refund request : app/item purchased not working as expected ,AppGallery ,Problem/Fault,Third Party APPs,Refund,
23683,66429,,support.eu@aspiegel.com,Aspiegel Support issue submit,"Product: AppGallery & Games Requests: Using AppGallery (i.e. manage service country) Contact Full Name: Inês Lavrador Ramos Phone Number: +*****(PHONE) Contact Email Address: xxxxx@xxxx.com Summary of the issue: Good morning! I would like to know how I can use a voucher that I won on app gallery since the store now was put together with other store, and I still have the voucher to use! thanks in advance! Home | News | Events | Products | Partners | Support Copyright Aspiegel SE","AppGallery /  Information request (e.g. prize delivery timeframe, how to join campaign)",AppGallery ,Suggestion,VIP / Offers / Promotions,Offers / Vouchers / Promotions,
23683,67433,,support.eu@aspiegel.com,Re: RE : Aspiegel Support issue submit,"Hello , good morning! So the campaign name was ""XMAS download and win play PT"" as you will see in the screenshot I will send you, and I won a voucher to use it in a online store called ""*****(PERSON)"" but now ""*****(PERSON)"" is a part of other company/store called ""*****(PERSON)"" And what's my Huawei I'd service country? Thanks in advance! A ter, 6 de set de *****(PHONE), 12:16, escreveu: Dear Customer, Thank you for contacting *****(PERSON). We hope you’re doing well. This email is regarding your concern about *****(PERSON) worry I will do my best to solve your problem as soon as possible. In order to analyze your case in detail I will need the following information from you: Error screenshot The name of the champagne you have attended Your Huawei Id Service country We would greatly appreciate your feedback regarding our email exchange, as we need your input to keep improving our service. Therefore, we invite you to fill in the survey that will soon arrive on the email address you used to contact us. If you have any further questions, please feel free to reply to this email thread and we will be happy to walk you through your doubts. Sincerely, Silvia *****(PERSON) Customer Support team *****(PERSON) SE is a company incorporated under the laws of Ireland with its headquarters in Dublin, Ireland. *****(PERSON) SE is the provider of Huawei Mobile Services to Huawei and Honor device owners in *****(LOC), Canada, Australia, New Zealand and other countries. From : xxxxx@xxxx.com Sent : Tuesday 06 September *****(PHONE) 12:17 To : xxxxx@xxxx.com Subject : *****(PERSON) Support issue submit Product: AppGallery & Games Requests: Using AppGallery (i.e. manage service country) Contact Full Name: Inês Lavrador Ramos Phone Number: +*****(PHONE) Contact Email Address: xxxxx@xxxx.com Summary of the issue: Good morning! I would like to know how I can use a voucher that I won on app gallery since the store now was put together with other store, and I still have the voucher to use! thanks in advance! Home | News | Events | Products | Partners | Support Copyright *****(PERSON) SE *****(PHONE)","AppGallery /  Information request (e.g. prize delivery timeframe, how to join campaign)",AppGallery ,Suggestion,VIP / Offers / Promotions,Offers / Vouchers / Promotions,
23683,67516,,support.eu@aspiegel.com,Re: RE : Aspiegel Support issue submit,"I have to an account there? also I don't speak german! escreveu no dia quinta, 8/09/*****(PHONE) à(s) 12:08: Dear Customer, We recommend that you contact us through the Discord channel https://discord.gg/tkYZC5CAGu directly from your computer. *****(PERSON) have to use Discord or if you prefer us to handle the case, please provide us with the following information for further investigation: - Your country of service AppGallery> Me> Settings> Country - Your Discord contact information, if applicable If you have any further questions, please reply to this email and we will be happy to assist you with your doubts. *****(PERSON), Andrea *****(PERSON) Customer Support team *****(PERSON) SE is a company incorporated under the laws of Ireland with its headquarters in Dublin, Ireland. *****(PERSON) SE is the provider of Huawei Mobile Services to Huawei and Honor device owners in *****(LOC), Canada, Australia, New Zealand and other countries. From : xxxxx@xxxx.com Sent : Thursday 08 September *****(PHONE) 12:20 To : xxxxx@xxxx.com Subject : Re: RE : *****(PERSON) Support issue submit Hello , good morning! So the campaign name was ""XMAS download and win play PT"" as you will see in the screenshot I will send you, and I won a voucher to use it in an online store called ""*****(PERSON)"" but now ""*****(PERSON)"" is a part of other company/store called ""*****(PERSON)"" And what's my Huawei I'd service country? Thanks in advance! A ter, 6 de set de *****(PHONE), 12:16, < xxxxx@xxxx.com> escreveu: Dear Customer, Thank you for contacting *****(PERSON). We hope you're doing well. This email is regarding your concern about *****(PERSON) worry I will do my best to solve your problem as soon as possible. In order to analyze your case in detail I will need the following information from you: Error screenshot The name of the champagne you have attended Your Huawei Id Service country We would greatly appreciate your feedback regarding our email exchange, as we need your input to keep improving our service. Therefore, we invite you to fill in the survey that will soon arrive on the email address you used to contact us. If you have any further questions, please feel free to reply to this email thread and we will be happy to walk you through your doubts. Sincerely, Silvia *****(PERSON) Customer Support team *****(PERSON) SE is a company incorporated under the laws of Ireland with its headquarters in Dublin, Ireland. *****(PERSON) SE is the provider of Huawei Mobile Services to Huawei and Honor device owners in *****(LOC), Canada, Australia, New Zealand and other countries. From : xxxxx@xxxx.com Sent : Tuesday 06 September *****(PHONE) 12:17 To : xxxxx@xxxx.com Subject : *****(PERSON) Support issue submit Product: AppGallery & Games Requests: Using AppGallery (i.e. manage service country) Contact Full Name: Inês Lavrador Ramos Phone Number: +*****(PHONE) Contact Email Address: xxxxx@xxxx.com Summary of the issue: Good tomorrow! I would like to know how I can use a voucher that I won on app gallery since the store now was put together with other store, and I still have the voucher to use! thanks in advance! Home | News | Events | Products | Partners | Support Copyright *****(PERSON) SE *****(PHONE) *****(PHONE)","AppGallery /  Information request (e.g. prize delivery timeframe, how to join campaign)",AppGallery ,Suggestion,VIP / Offers / Promotions,Offers / Vouchers / Promotions,
23683,67915,,support.eu@aspiegel.com,Re: RE : Aspiegel Support issue submit,"Sure, the country of my app gallery and my country is Portugal! I can't enter on discord sorry, I don't understand it! A qui, 8 de set de *****(PHONE), 13:07, escreveu: Dear Customer, This email is regarding your concern about *****(PERSON) voucher. We recommend that you contact us through the Discord channel https://discord.gg/tkYZC5CAGu directly from your computer. If you are having difficulty using Discord, or if you prefer us to handle the case, please provide us with the following information for further investigation: - Your country of service AppGallery> Me> Settings> Country. - Your Discord contact information, if applicable. If you have any further questions, please reply to this e-Mail and we will be happy to help you with your doubts. Sincerely, Andrea *****(PERSON) Customer Support team *****(PERSON) SE is a company incorporated under the laws of Ireland with its headquarters in Dublin, Ireland. *****(PERSON) SE is the provider of Huawei Mobile Services to Huawei and Honor device owners in *****(LOC), Canada, Australia, New Zealand and other countries. From : xxxxx@xxxx.com Sent : Thursday 08 September *****(PHONE) 13:48 To : xxxxx@xxxx.com Subject : Re: RE : *****(PERSON) Support issue submit I have to an account there? also I don't speak german! < xxxxx@xxxx.com> escreveu no dia quinta, 8/09/*****(PHONE) à(s) 12:08: Sehr geehrter Kunde, wir empfehlen Ihnen, uns über den Discord-Kanal https://discord.gg/tkYZC5CAGu direkt von Ihrem Computer aus zu kontaktieren. *****(PERSON) haben, Discord zu benutzen, oder wenn Sie es vorziehen, dass wir den Fall bearbeiten, geben Sie uns bitte folgende Informationen für weitere Untersuchungen: - Ihr Dienstland AppGallery> Ich> Einstellungen> Land - Ihre Discord-Kontaktinformationen, falls zutreffend Wenn Sie weitere Fragen haben, antworten Sie bitte auf diesen e-Mail und wir helfen Ihnen gerne bei Ihren Zweifeln weiter. *****(PERSON), Andrea *****(PERSON) Customer Support team *****(PERSON) SE is a company incorporated under the laws of Ireland with its headquarters in Dublin, Ireland. *****(PERSON) SE is the provider of Huawei Mobile Services to Huawei and Honor device owners in *****(LOC), Canada, Australia, New Zealand and other countries. From : xxxxx@xxxx.com Sent : Thursday 08 September *****(PHONE) 12:20 To : xxxxx@xxxx.com Subject : Re: RE : *****(PERSON) Support issue submit Hello , good morning! So the campaign name was ""XMAS download and win play PT"" as you will see in the screenshot I will send you, and I won a voucher to use it in a online store called ""*****(PERSON)"" but now ""*****(PERSON)"" is a part of other company/store called ""*****(PERSON)"" And what's my Huawei I'd service country? Thanks in advance! A ter, 6 de set de *****(PHONE), 12:16, < xxxxx@xxxx.com> escreveu: Dear Customer, Thank you for contacting *****(PERSON). We hope you’re doing well. This email is regarding your concern about *****(PERSON) worry I will do my best to solve your problem as soon as possible. In order to analyze your case in detail I will need the following information from you: Error screenshot The name of the champagne you have attended Your Huawei Id Service country We would greatly appreciate your feedback regarding our email exchange, as we need your input to keep improving our service. Therefore, we invite you to fill in the survey that will soon arrive on the email address you used to contact us. If you have any further questions, please feel free to reply to this email thread and we will be happy to walk you through your doubts. Sincerely, Silvia *****(PERSON) Customer Support team *****(PERSON) SE is a company incorporated under the laws of Ireland with its headquarters in Dublin, Ireland. *****(PERSON) SE is the provider of Huawei Mobile Services to Huawei and Honor device owners in *****(LOC), Canada, Australia, New Zealand and other countries. From : xxxxx@xxxx.com Sent : Tuesday 06 September *****(PHONE) 12:17 To : xxxxx@xxxx.com Subject : *****(PERSON) Support issue submit Product: AppGallery & Games Requests: Using AppGallery (i.e. manage service country) Contact Full Name: Inês Lavrador Ramos Phone Number: +*****(PHONE) Contact Email Address: xxxxx@xxxx.com Summary of the issue: Good morning! I would like to know how I can use a voucher that I won on app gallery since the store now was put together with other store, and I still have the voucher to use! thanks in advance! Home | News | Events | Products | Partners | Support Copyright *****(PERSON) SE *****(PHONE) *****(PHONE) *****(PHONE)","AppGallery /  Information request (e.g. prize delivery timeframe, how to join campaign)",AppGallery ,Suggestion,VIP / Offers / Promotions,Offers / Vouchers / Promotions,
23624,66266,,support.pt@aspiegel.com,[GameCentre]Problems and suggestions,Description No Moontoon Contact information xxxxx@xxxx.com Sent from my Huawei phone,AppGallery / Other Requests,AppGallery ,Problem/Fault,AppGallery-Install/Upgrade,Can't download Apps,
23555,65977,,support.pt@aspiegel.com,[AppGallery]Issues and Suggestions,"Description I don't understand DNS is never working, could you help me??? Contact information *****(PHONE). - xxxxx@xxxx.com Sent from my cell phoneDescription I don't understand why the DNS is never working', can you help me? Contact information *****(PHONE). - xxxxx@xxxx.com Sent from my cell phone",AppGallery / Other Requests,AppGallery ,Problem/Fault,General,Cannot connect - Server,
23534,65883,,support.pt@aspiegel.com,[AppGallery]Problems and suggestions,Description COMIT Fails to INSTALL Contact information xxxxx@xxxx.com Sent from my Huawei phone,AppGallery / Suggestions &amp; Feedback,AppGallery ,Problem/Fault,AppGallery-Install/Upgrade,,Can't install Apps
23477,65661,,support.pt@aspiegel.com,Re: support.pt Auto-reply: [AppGallery]Problems and suggestions,"Huawi health On Mon, 5 Sept *****(PHONE), 1:40 pm , wrote: Hi, We appreciate your contact! Our support representatives will check your message and get back to you as soon as possible. We appreciate your patience and cooperation. Sincerely, Aspiegel Customer Support Team. _____________________________________ Aspiegel SE is a company incorporated under the laws of Ireland, headquartered in Dublin, Ireland. Aspiegel SE is the Huawei Mobile Services provider for Huawei and Honor device owners in Europe, Canada, Australia, New Zealand and other countries.Huawi health On Mon, 5 Sept *****(PHONE), 1:40 pm , wrote: Hi, We appreciate your contact! Our support representatives will check your message and get back to you as soon as possible. We appreciate your patience and cooperation. Sincerely, Aspiegel Customer Support Team. _____________________________________ Aspiegel SE is a company incorporated under the laws of Ireland, headquartered in Dublin, Ireland. Aspiegel SE is the provider of Huawei Mobile Services for Huawei and Honor device owners in Europe, Canada, Australia, New Zealand and other countries.",AppGallery / Other Requests,AppGallery ,Others,,,
23452,65616,,support.pt@aspiegel.com,[AppGallery]Issues and Suggestions,Description can't install Contact Information 962 225 736 Sent from my Huawei cell phone. Description can't install Contact Information 962 225 736 Sent from my Huawei cell phone.,AppGallery / Suggestions &amp; Feedback,AppGallery ,Problem/Fault,AppGallery-Install/Upgrade,Can't install Apps,
23429,65569,,support.pt@aspiegel.com,[AppGallery]Issues and Suggestions,Description does not install Contact information xxxxx@xxxx.comDescription does not install Contact information xxxxx@xxxx.com,AppGallery / Other Requests,AppGallery ,Problem/Fault,AppGallery-Install/Upgrade,Can't install Apps,
23395,65482,,support.pt@aspiegel.com,[AppGallery]Problems and solutions,Description In the area where I am (*****(LOC)) there is no connection (3 Fastweb devices) and we are having difficulties with calls. No connection to the Internet. Contact information *****(PHONE) - *****(PHONE) - *****(PHONE) Sent from my Huawei tabletDescription In the area where I am (*****(LOC)) there is no connection (3 Fastweb devices) and we are having difficulties with calls. No connection to the Internet. Contact information *****(PHONE) - *****(PHONE) - *****(PHONE) Sent from my Huawei tablet,AppGallery / Other Requests,AppGallery ,Others,,,
23230,65024,,support.pt@aspiegel.com,[AppGallery]Issues and suggestions,Description What's up Contact info *****(PHONE) Sent from my phone HuaweiDescription What's up Contact info *****(PHONE) Sent from my phone Huawei,AppGallery / Other Requests,AppGallery ,Others,,,
23229,65022,,support.pt@aspiegel.com,[AppGallery]Problems and suggestions,Description What's up Contact information *****(PHONE) Sent from my Huawei phone,AppGallery / Other Requests,AppGallery ,Others,,,
23212,64982,,support.pt@aspiegel.com,[AppGallery]Problems and suggestions,OK Description What's up Contact information *****(PHONE) Sent from my Huawei phone,AppGallery / Other Requests,AppGallery ,Others,,,
23194,64946,,support.pt@aspiegel.com,[AppGallery]Problems and suggestions,Description Installation error Contact information *****(PHONE),AppGallery / Other Requests,AppGallery ,Problem/Fault,AppGallery-Install/Upgrade,Other download/install/update issue,
23193,64944,,support.pt@aspiegel.com,[AppGallery]Problems and suggestions,Description Installation error Contact information +*****(PHONE) *****(PER),AppGallery / Other Requests,AppGallery ,Problem/Fault,AppGallery-Install/Upgrade,Other download/install/update issue,
23189,64938,,support.pt@aspiegel.com,[AppGallery]Problems and suggestions,Description Please fix them. Contact information xxxxx@xxxx.com,AppGallery / Other Requests,AppGallery ,Suggestion,General,Personal data,
23188,64936,,support.pt@aspiegel.com,[AppGallery]Problems and suggestions,Description U. Contact information xxxxx@xxxx.com,AppGallery / Other Requests,AppGallery ,Suggestion,General,Personal data,
23056,64550,44805.93403,support.pt@aspiegel.com,[AppGallery]Problems and suggestions,"Description My phone data and privacy is insecure...all apps and accounts are copied and shared by third parties without my consent. I wish to report that everything used here is still not private. As we speak, I'm scared and frustrated about this issue. Contact information xxxxx@xxxx.com",AppGallery / Report a scam or fraud ,AppGallery ,Suggestion,General,Personal data,
23055,64549,44805.91319,support.pt@aspiegel.com,[AppGallery]Problems and Suggestions,Description Cannot install Contact details xxxxx@xxxx.com,AppGallery / Suggestions &amp; Feedback,AppGallery ,Problem/Fault,AppGallery-Install/Upgrade,Other download/install/update issue,
23054,64548,44805.91319,support.pt@aspiegel.com,[AppGallery]Problems and Suggestions,Description No installation possible Contact information xxxxx@xxxx.comDescription No installation possible Contact information xxxxx@xxxx.com,AppGallery / Suggestions &amp; Feedback,AppGallery ,Problem/Fault,AppGallery-Install/Upgrade,Other download/install/update issue,
23052,64544,44805.88819,support.pt@aspiegel.com,[AppGallery]Problems and suggestions,Description: It does not upload. Contact information: 0 543 375 79 90,AppGallery / Suggestions &amp; Feedback,AppGallery ,Problem/Fault,General,AppGallery not loading,
